{
  "spec": "local-first-business-app",
  "specVersion": "1.1.0",
  "audience": "LLM coding agents (Codex, Claude, etc.)",
  "purpose": "Implement a local-first desktop point-of-sale / business app for a single-location small business, reusing a fixed set of primitives. The reference implementation is a tire shop; this spec generalizes it to other domains (hair salons, barber shops, detail shops, flower shops, and similar service+product businesses).",
  "howToUse": [
    "Read this file top to bottom before writing code.",
    "Build the domain-agnostic CORE exactly as specified (architecture, primitives, constraints).",
    "Then apply ONE domainPack to customize branding, categories, and seed data. Do not fork the core per domain — only the domainPack changes.",
    "Honor every entry in 'constraints' — each one encodes a real bug that was fixed in the reference implementation.",
    "Run the 'verification' steps before declaring done.",
    "'constraints' is a LIVING LOG of real bugs. When you hit and fix a non-obvious issue, append a new entry (id + rule + why) so the next instantiation cannot repeat it."
  ],

  "architecture": {
    "pattern": "Local-first desktop app = Electron app shell + a Deno HTTP backend running as a localhost sidecar process + a single-file SQLite database. Fully offline; no cloud, no accounts.",
    "processes": [
      {
        "name": "electron-main",
        "runtime": "Node (Electron main process)",
        "responsibilities": [
          "Create the BrowserWindow (contextIsolation: true, nodeIntegration: false).",
          "Pick a free 127.0.0.1 port, spawn the Deno backend as a child process, pass POS_PORT and POS_DB_PATH via env.",
          "Poll GET /health until ready, then load the UI.",
          "Expose a minimal IPC bridge for OS-only actions (print, save-PDF).",
          "Kill the sidecar on quit."
        ]
      },
      {
        "name": "backend",
        "runtime": "Deno + Hono",
        "responsibilities": [
          "HTTP API bound strictly to 127.0.0.1 (never a public interface).",
          "SQLite persistence via node:sqlite (built into Deno; no native build).",
          "All money math and aggregation server-side."
        ]
      },
      {
        "name": "renderer",
        "runtime": "Vite + React + TypeScript + Tailwind (Chromium renderer)",
        "responsibilities": [
          "Touch-friendly UI (large targets, big type) for non-technical staff.",
          "Talks to the backend over http://127.0.0.1:<port> via fetch.",
          "Calls the preload bridge for print / save-PDF."
        ]
      }
    ],
    "boundaries": [
      "renderer -> backend: plain HTTP over loopback (runtime-agnostic, cloud-portable later).",
      "renderer -> electron-main: a tiny contextBridge surface (window.app) for OS actions only."
    ],
    "packaging": "deno compile the backend into a single self-contained exe; electron-builder bundles it as an extraResource and produces a Windows NSIS installer. Target PC needs neither Deno nor Node installed."
  },

  "techStack": {
    "backend": { "runtime": "Deno 2.x", "framework": "jsr:@hono/hono@^4", "db": "node:sqlite (built-in)", "test": "deno test + jsr:@std/assert" },
    "shell": { "framework": "Electron ^41", "packager": "electron-builder ^25 (nsis, win)" },
    "frontend": { "build": "Vite ^6", "ui": "React ^18 + TypeScript ^5.7", "styles": "Tailwind ^3", "charts": "hand-rolled inline SVG (NO chart library — keep it offline and dependency-free)" }
  },

  "constraints": [
    {
      "id": "money-integer-cents",
      "rule": "Store and compute all money as integer cents. Never use floats for currency.",
      "why": "Avoids floating-point rounding errors in totals/tax."
    },
    {
      "id": "server-side-totals",
      "rule": "The backend recomputes subtotal/tax/total from line items and the stored tax rate on every create. Never trust totals sent by the client.",
      "why": "Integrity and tamper-resistance."
    },
    {
      "id": "local-day-grouping",
      "rule": "Store created_at as UTC ISO for display, but also store a separate sale_date = local YYYY-MM-DD and group/report by sale_date.",
      "why": "Grouping by the UTC slice of created_at drops evening sales from 'today' in negative UTC offsets. Use a localDateString() helper for both writing sale_date and computing 'today'."
    },
    {
      "id": "deno-compile-no-npm",
      "rule": "The deno.json build:backend task MUST pass --no-npm and set \"nodeModulesDir\": \"none\".",
      "why": "Otherwise deno compile detects the Electron package.json and embeds the entire node_modules tree into the backend exe (hundreds of MB)."
    },
    {
      "id": "windows-sidecar-no-console",
      "rule": "The Windows backend exe MUST be compiled with deno compile --no-terminal, and Electron MUST spawn the packaged sidecar with windowsHide:true and stdio:'ignore' (dev may keep stdio:'inherit').",
      "why": "Without these, launching the installed POS also opens a visible backend console window, which looks broken to staff and invites accidental closure of the sidecar."
    },
    {
      "id": "commonjs-preload",
      "rule": "Compile electron/ (main + preload) as CommonJS, and write a dist-electron/package.json containing {\"type\":\"commonjs\"} during the build. The root package.json is \"type\":\"module\".",
      "why": "Electron's sandboxed preload cannot be an ES module; an ESM preload silently fails to load, leaving window.app undefined (print/save-PDF break)."
    },
    {
      "id": "sqlite-backup-method",
      "rule": "For backups, do NOT use 'VACUUM INTO' (unsupported by node:sqlite — attached-db limit is 0). Instead run PRAGMA wal_checkpoint(TRUNCATE) then copy the db file.",
      "why": "node:sqlite limitation; checkpoint+copy yields a consistent standalone snapshot."
    },
    {
      "id": "additive-migrations",
      "rule": "Schema changes are additive and idempotent: CREATE TABLE IF NOT EXISTS, plus an addColumnIfMissing(table,col,type) helper that checks PRAGMA table_info before ALTER. Backfill new columns. Never drop/rewrite existing data on upgrade.",
      "why": "Installed copies already hold the business's live data."
    },
    {
      "id": "localhost-only",
      "rule": "Bind the backend to 127.0.0.1 only. Pick a free ephemeral port at launch; the renderer learns it via a ?port= query param and/or the preload bridge.",
      "why": "Security; never expose the API to the network."
    },
    {
      "id": "secure-electron",
      "rule": "contextIsolation: true, nodeIntegration: false. Expose only an explicit, minimal API via contextBridge (e.g., window.app = { backendBaseUrl, printDoc, savePdf }).",
      "why": "Standard Electron security posture."
    },
    {
      "id": "offline-charts",
      "rule": "Render charts/sparklines as inline SVG. Do not add a charting dependency.",
      "why": "Keeps the app fully offline and the bundle small."
    },
    {
      "id": "version-in-ui-and-changelog",
      "rule": "Inject the package.json version at build time (Vite define __APP_VERSION__) and show it subtly in the header + a Settings 'About' line. Bump package.json version and add a CHANGES.md entry for every shippable change.",
      "why": "Lets staff/support identify the running build; keeps in-place installer upgrades clean (NSIS upgrades require an equal-or-higher version)."
    },
    {
      "id": "vite-relative-base",
      "rule": "Set \"base\": \"./\" in vite.config.ts so the built index.html references ./assets/... (relative), not /assets/... (absolute).",
      "why": "The packaged app loads index.html over the file:// protocol. Absolute /assets/ paths resolve to the filesystem root and 404, leaving a blank window. Add did-fail-load logging in electron/main.ts so a load failure is never silent."
    },
    {
      "id": "embed-binary-assets",
      "rule": "Any static asset the BACKEND serves (logo, images) must be embedded as a base64 data URI compiled into the exe — generate a TS module (e.g. backend/logo.ts via scripts/embed-logo.mjs) and import it. The RENDERER imports the same file as a normal Vite asset (import logoUrl from './assets/x.jpg').",
      "why": "The backend ships as a single 'deno compile' exe with no asset files on disk, so it cannot read a logo from the filesystem at runtime. Inlined data URIs also avoid async <img> load races during print()/printToPDF()."
    },
    {
      "id": "print-color-fidelity",
      "rule": "Receipts that use color (brand bars, logos) MUST set '-webkit-print-color-adjust: exact; print-color-adjust: exact;' and an '@page { size: 80mm auto; margin: 0 }'. Electron's webContents.print() has NO preview pane, so provide an in-app preview by rendering the receipt HTML in a sandboxed <iframe srcDoc=...> with Print / Save PDF buttons.",
      "why": "Without print-color-adjust, Chromium drops background colors when printing/exporting. Staff expect to see the receipt before printing; webContents.print() jumps straight to the OS dialog, so the iframe IS the preview (and gives the browser's native preview during dev)."
    },
    {
      "id": "additive-settings-keys",
      "rule": "A new settings key must be added in THREE places: (1) seed() defaults in db.ts, (2) the ALLOWED set in routes/settings.ts, and (3) a code-level fallback default where it is consumed (e.g. receipt.ts). Never assume the key exists.",
      "why": "seed() only runs when the settings table is EMPTY, so already-installed DBs never receive the new key. The consuming code must fall back to a default until the user saves Settings; the allow-list gate silently drops keys it doesn't recognize."
    },
    {
      "id": "node-sqlite-row-typing",
      "rule": "node:sqlite .all()/.get() return Record<string, SQLOutputValue>. Cast typed rows through unknown first: 'stmt.all() as unknown as Row[]'. Coerce money columns with Number() at the boundary if doing arithmetic.",